牌名,店名,最低价,分类,抓取时间
万智牌全军覆灭,童梦徐汇万智牌店,5,【童梦徐汇】 万智牌 MTG M20 简中 全军覆灭 金,2019/10/25 0:08
万智牌垦殖妖精,虫子桌游,12.2,【虫子桌游】万智牌MTG M20 核心系列 垦殖妖精 绿色 金 简中,2019/10/25 0:08
万智牌黑檀军团骑士,时间守护者的驿站,18,万智牌 M20 核心系列 黑檀军团骑士 金,2019/10/25 0:08
万智牌烈焰骁骑,NewMoon卡牌,10,【NewMoon卡牌】万智牌 M20 核心系列2020 烈焰骁骑 密稀,2019/10/25 0:08
万智牌冰牙寇特蛇,十二星座卡牌,17,万智牌 冰牙寇特蛇 简中 摩登新篇 多色 金,2019/10/25 0:08
万智牌集宝奥夫,盗梦空间卡牌,18,[盗梦空间]MTG万智牌 集宝奥夫 摩登新篇MH1 简中,2019/10/25 0:08
万智牌幻灭终时,卡牌天地,30,万智牌 闪幻灭终时 火花之战 秘稀 简中平卡/简中纪念闪/带旅法,2019/10/25 0:08
万智牌扣留代行官,青岛时间行走卡牌,19,【时间行走】万智牌 扣留代行官 简中 效忠拉尼卡 多色 金,2019/10/25 0:08
万智牌艾蓝卓幽谷大法师,Kenny万智,24.9,【Kenny万智】 万智牌 艾蓝卓幽谷大法师 英文 UMA,2019/10/25 0:08
万智牌非瑞克西亚祭坛,FCG卡牌商城,75,(FCG)万智牌 UMA 非瑞克西亚祭坛,2019/10/25 0:08
万智牌虔诚德鲁伊,时间守护者的驿站,8,万智牌 虔诚德鲁伊 终极大师 英文 UMA 银,2019/10/25 0:08
万智牌奥札奇征召,万智萌新传,14.88,万智牌 奥札奇征召 奥札奇再起 简中,2019/10/25 0:08
万智牌搅扰群列,盗梦空间卡牌,8,[盗梦空间]MTG万智牌 搅扰群列 终极大师UMA 英文,2019/10/25 0:08
万智牌把握今朝,回忆e时代 万智牌卡店,2.99,【回忆e时代】万智牌 终极大师 把握今朝 英文 红色 金,2019/10/25 0:09
万智牌阴界渡桥,莎莎de小窝,24,【莎莎的小窝】万智牌 UMA 金 阴界渡桥 英文,2019/10/25 0:09
万智牌滋养群列,一诺卡牌,5,万智牌 MTG 滋养群列 最终大师 UMA 英文 金 175 平闪,2019/10/25 0:09
万智牌爆雷炼球,万智牌王府井卡牌部落,7.99,【王府井卡牌】万智牌 爆雷炼球 简体中文 图片版本,2019/10/25 0:09
万智牌红月贤者,魔法风云会,35,万智牌 红月贤者 Magus of the Moon 中 英 IMA 金 闪 平,2019/10/25 0:09
万智牌众神之怒,童梦徐汇万智牌店,13.5,【童梦徐汇】 万智牌 众神之怒 简中 塞洛斯 红色,2019/10/25 0:09
万智牌特务法术师雅亚巴拉德,tuntunbaiwu,8,万智牌 特务法术师雅亚巴拉德 简中 时间漩涡 cm,2019/10/25 0:09
万智牌米捷兹的精研,北京大力鱼万智牌,40,万智牌 C15 简中 红 金 法术 029 米捷兹的精研,2019/10/25 0:09
万智牌繁殖地煽动者,九叔的万智牌,58,九叔万智牌 繁殖地煽动者 对决闪 人鱼VS鬼怪 帮七哥卖,2019/10/25 0:09
万智牌个人导师,真橙卡牌,130,[真橙]万智牌 MTG 个人导师 Personal Tutor 博图 英文,2019/10/25 0:09
万智牌行商卷轴,小艾的魔法,30.00,万智牌 行商卷轴 家园 英文 蓝色 银 【小艾的魔法】,2019-10-25 00:20:26
万智牌回撤,2015的卡牌小铺,50.00,万智牌 回撤 Retract 简中NM 玄铁 金 9+,2019-10-25 00:20:31
万智牌花之毯,鹏飞MTG,95.00,万智牌 克撒传 花之毯-英日文,2019-10-25 00:20:36
万智牌苗生谬思,沃泰傅狼人杀桌游俱乐部,15.00,【W.T.F】万智牌 苗生谬思 火线齐心 BBD 稀有金 中文,2019-10-25 00:20:41
万智牌善变巨像,魔法迷你仓,18.00,万智牌 英文 善变巨像 指挥官2015 金,2019-10-25 00:20:46
万智牌赞迪卡复仇者,5J 闪卡工坊,7.50,5J闪万智牌衍生物 植物0/1 赞迪卡之声妮莎 赞迪卡复仇者,2019-10-25 00:20:51
万智牌抑制力场,蒲原杂货铺,12.00,万智牌 抑制力场 中英 RAV,2019-10-25 00:20:56
万智牌抽地税,鹏飞MTG,60.00,万智牌 火线齐心 抽地税-中文,2019-10-25 00:21:01
万智牌毁天灭地,Kenny万智,12.00,【Kenny万智】万智牌 毁天灭地 英文 老版,2019-10-25 00:21:06
万智牌狮族仲裁者,青岛时间行走卡牌,22.00,万智牌 狮族仲裁者 简中 秘罗地创痕 SOM 白色 金,2019-10-25 00:21:11
万智牌净钢神圣武士,平平的万智牌店,40.00,万智牌 净钢神圣武士 简中 新非瑞克西亚 金,2019-10-25 00:21:15
万智牌希望天使艾维欣,M3卡牌俱乐部,49.00,【特价】MTG 万智牌 牌垫/桌布 希望天使艾维欣,2019-10-25 00:21:20
万智牌肢解,广州桌粤卡牌店,9.00,【广州桌粤】万智牌 MTG 简中/英文 肢解 Dismember,2019-10-25 00:21:25
万智牌物尽其用,万智牌王府井卡牌部落,7.99,MTG 万智牌 中文 物尽其用 核心系列2015 M15 黑 金,2019-10-25 00:21:30
万智牌黑暗冲击波,武汉鹏洛客卡牌,15.00,【鹏洛客卡牌】万智牌 拉尼卡公会城 RAV 黑暗冲击波 英文,2019-10-25 00:28:40
万智牌除灭,潜行之虎卡牌Bar,0.45,万智牌 简中 英文 平/闪 灭除火花 火花之战 WAR 多色,2019-10-25 00:28:47
万智牌镇咒灵,北境卡牌,40.00,［北境卡牌］万智牌 MTG 异月传奇 EMN 镇咒灵 简中/英文 金,2019-10-25 00:28:54
万智牌碎末石碾,九叔的万智牌,108.00,九叔万智牌 碎末石碾 暴风雨 日文 帮七哥卖 Grindstone,2019-10-25 00:29:01
万智牌地源守护妮莎,我们卡牌屋 WE卡牌屋 万智牌店,12.99,万智牌 MTG 地源守护妮莎 阿芒凯 AKH 秘稀 多色,2019-10-25 00:29:08
万智牌冬之球,游戏王万智牌TCG卡牌店,15.00,万智牌 冬之球 神器 金 永恒大师 经典大师 EMA 日文！,2019-10-25 00:29:15
万智牌迅雷护胫,zzsweet,20.00,万智牌 迅雷护胫 简中 指挥官 2015 C15 无色 神器 银,2019-10-25 00:29:22
万智牌噬人蛙怪,曲多卡牌,15.00,[曲多卡牌]万智牌 噬人蛙怪 简中/英/日 依尼翠暗影 多色 秘稀,2019-10-25 00:29:30
