行政区域,项目名称,项目位置,土地用途,行业分类,面积(公顷),供地方式,土地使用年限,成交价(万元),约定容积率,合同签订日期,数据来源,数据写入日期
安顺市本级,二环路与武当山路交叉口东北角地块建设项目,二环路与武当山路交叉口东北角,中低价位、中小套型普通商品住房用地,其他服务业,1.744500,挂牌出让,中低价位、中小套型普通商品住房用地70年;其他普通商品住房用地70年;批发零售用地40年;,2382.0000,下限:1.00上限:2.00,2015年09月10日,https://www.landchina.com/default.aspx?tabid=386&comname=default&wmguid=75c72564-ffd9-426a-954b-8ac2df0903b7&recorderguid=89134768-ed10-4ce4-8266-50fa416e7cdb,2019-08-28 12:33:44
安顺市本级,安顺垃圾焚烧发电项目,轿子山大进村,工业用地,公共设施管理业,6.700827,挂牌出让,50,1195.0000,下限:0.00上限:0.55,2015年08月25日,https://www.landchina.com/default.aspx?tabid=386&comname=default&wmguid=75c72564-ffd9-426a-954b-8ac2df0903b7&recorderguid=f939ba3c-ff19-41f4-bda4-41a21b35d49f,2019-08-28 12:33:49
安顺市本级,南出口安紫公路与龙宫大道交叉口东南角地块建设项目,西秀区华西办事处玉碗井村,批发零售用地,房地产业,13.691600,挂牌出让,中低价位、中小套型普通商品住房用地70年;批发零售用地40年;住宿餐饮用地40年;其他普通商品住房用地70年;仓储用地50,2054.0000,下限:1.00上限:1.51,2015年05月13日,https://www.landchina.com/default.aspx?tabid=386&comname=default&wmguid=75c72564-ffd9-426a-954b-8ac2df0903b7&recorderguid=83200a7a-741d-4291-a719-624d7d2ed017,2019-08-28 12:33:58
安顺市本级,马家冲加油站地块建设项目,二环路与市府路交叉口东侧,批发零售用地,零售业,0.313519,挂牌出让,40,269.0000,下限:0.00上限:0.40,2015年04月30日,https://www.landchina.com/default.aspx?tabid=386&comname=default&wmguid=75c72564-ffd9-426a-954b-8ac2df0903b7&recorderguid=decfbe99-f123-443a-84ba-59f3f398afba,2019-08-28 12:34:01
安顺市本级,西秀区武当路与北航路交叉口西北角地块建设项目,武当路与北航路交叉口西北角,中低价位、中小套型普通商品住房用地,房地产业,4.004500,挂牌出让,中低价位、中小套型普通商品住房用地70年;批发零售用地40年;其他普通商品住房用地70,601.0000,下限:1.00上限:2.20,2015年04月30日,https://www.landchina.com/default.aspx?tabid=386&comname=default&wmguid=75c72564-ffd9-426a-954b-8ac2df0903b7&recorderguid=c7d89dde-5373-4dc3-9faa-a95103ccc366,2019-08-28 12:34:08
安顺市本级,虹山湖H4-01地块建设项目,西秀区东山路,批发零售用地,房地产业,4.614144,挂牌出让,中低价位、中小套型普通商品住房用地70年;批发零售用地40年;其他普通商品住房用地70,693.0000,下限:1.00上限:3.80,2015年04月30日,https://www.landchina.com/default.aspx?tabid=386&comname=default&wmguid=75c72564-ffd9-426a-954b-8ac2df0903b7&recorderguid=0e440e0e-520b-48b5-96a4-d29c66213d85,2019-08-28 12:34:14
安顺市本级,虹山湖H4-02地块建设项目,西秀区东山路,中低价位、中小套型普通商品住房用地,房地产业,4.722683,挂牌出让,批发零售用地40年;中低价位、中小套型普通商品住房用地70年;其他普通商品住房用地70年;,996.0000,下限:1.00上限:2.60,2015年04月30日,https://www.landchina.com/default.aspx?tabid=386&comname=default&wmguid=75c72564-ffd9-426a-954b-8ac2df0903b7&recorderguid=09f1827c-96ad-458c-8745-3bfa68609790,2019-08-28 12:34:18
安顺市本级,西秀区玻璃厂、化工厂地块建设项目,西秀区凤东路,中低价位、中小套型普通商品住房用地,房地产业,0.148572,挂牌出让,批发零售用地40年;中低价位、中小套型普通商品住房用地70年;其他普通商品住房用地70年;,119.0000,下限:1.00上限:4.50,2015年04月30日,https://www.landchina.com/default.aspx?tabid=386&comname=default&wmguid=75c72564-ffd9-426a-954b-8ac2df0903b7&recorderguid=26ef9b99-2c61-4d75-bf73-7618fe20b3b2,2019-08-28 12:34:25
安顺市本级,北航路与二十五号路交叉口西南角地块建设项目,北航路与二十五号路交叉口西南角,中低价位、中小套型普通商品住房用地,房地产业,4.073800,挂牌出让,批发零售用地40年;中低价位、中小套型普通商品住房用地70年;其他普通商品住房用地70年;,612.0000,下限:1.00上限:2.70,2015年04月30日,https://www.landchina.com/default.aspx?tabid=386&comname=default&wmguid=75c72564-ffd9-426a-954b-8ac2df0903b7&recorderguid=5b6fb421-1e68-4386-bd35-08a891b743ed,2019-08-28 12:34:33
安顺市本级,武当路东侧、人工湖西侧地块建设项目,西秀区武当路东侧、人工湖西侧,中低价位、中小套型普通商品住房用地,房地产业,0.560500,挂牌出让,批发零售用地40年;中低价位、中小套型普通商品住房用地70年;其他普通商品住房用地70年;,85.0000,下限:1.00上限:2.00,2015年04月30日,https://www.landchina.com/default.aspx?tabid=386&comname=default&wmguid=75c72564-ffd9-426a-954b-8ac2df0903b7&recorderguid=692b69bb-2d2a-42e5-b275-0202f7168d81,2019-08-28 12:34:41
安顺市本级,虹山湖东山路H3地块建设项目,西秀区东山路,中低价位、中小套型普通商品住房用地,房地产业,3.338055,挂牌出让,批发零售用地40年;中低价位、中小套型普通商品住房用地70年;其他普通商品住房用地70年;住宿餐饮用地40年;,501.0000,下限:1.00上限:2.80,2015年04月30日,https://www.landchina.com/default.aspx?tabid=386&comname=default&wmguid=75c72564-ffd9-426a-954b-8ac2df0903b7&recorderguid=793c4ab2-1e07-4ef7-9be2-0f186b8561bf,2019-08-28 12:34:51
安顺市本级,小十字五中校址地块建设项目,中华南路与蒋衙街交界处,批发零售用地,房地产业,0.128540,挂牌出让,40,1439.0000,下限:1.00上限:3.30,2015年04月30日,https://www.landchina.com/default.aspx?tabid=386&comname=default&wmguid=75c72564-ffd9-426a-954b-8ac2df0903b7&recorderguid=823d5af3-e42b-4d99-9879-2dcfaeab7b13,2019-08-28 12:34:58
安顺市本级,武当路与二环路交叉口西南角地块建设项目,武当路与二环路交叉口西南角,中低价位、中小套型普通商品住房用地,房地产业,2.591600,挂牌出让,批发零售用地40年;中低价位、中小套型普通商品住房用地70年;其他普通商品住房用地70年;,389.0000,下限:1.00上限:2.20,2015年04月30日,https://www.landchina.com/default.aspx?tabid=386&comname=default&wmguid=75c72564-ffd9-426a-954b-8ac2df0903b7&recorderguid=858d8715-7f7e-4346-bb35-bbe0f8834638,2019-08-28 12:35:04
安顺市本级,武当路与北二十号路交叉口东南角地块建设项目,西秀区武当路与北二十号路交叉口东南角,中低价位、中小套型普通商品住房用地,房地产业,1.038100,挂牌出让,批发零售用地40年;中低价位、中小套型普通商品住房用地70年;其他普通商品住房用地70年;,156.0000,下限:1.00上限:2.00,2015年04月30日,https://www.landchina.com/default.aspx?tabid=386&comname=default&wmguid=75c72564-ffd9-426a-954b-8ac2df0903b7&recorderguid=8cf75740-688c-4d03-9a67-ef984b3f569e,2019-08-28 12:35:08
安顺市本级,旧州镇农贸市场、集市、公租房及古镇新区商业步行街F地块项目,西秀区旧州镇,中低价位、中小套型普通商品住房用地,房地产业,2.291229,挂牌出让,批发零售用地40年;其他普通商品住房用地70年;中低价位、中小套型普通商品住房用地70,344.0000,下限:1.00上限:1.27,2015年02月25日,https://www.landchina.com/default.aspx?tabid=386&comname=default&wmguid=75c72564-ffd9-426a-954b-8ac2df0903b7&recorderguid=e1f021ba-4450-41c8-8a9e-2c03f3fb4d30,2019-08-28 12:35:14
安顺市本级,虹山湖东山路H5地块建设项目,西秀区东山路,中低价位、中小套型普通商品住房用地,房地产业,4.384312,挂牌出让,批发零售用地40年;商务金融用地40年;住宿餐饮用地40年;中低价位、中小套型普通商品住房用地70年;其他普通商品住房用地70,658.0000,下限:1.00上限:4.90,2014年11月12日,https://www.landchina.com/default.aspx?tabid=386&comname=default&wmguid=75c72564-ffd9-426a-954b-8ac2df0903b7&recorderguid=e7ec71ba-e42b-479a-8697-999569560595,2019-08-28 12:35:16
安顺市本级,东出口Ｊ2-2地块(一期)建设项目,西秀区七眼桥镇,批发零售用地,商务服务业,6.984500,挂牌出让,中低价位、中小套型普通商品住房用地70年;批发零售用地40年;其他普通商品住房用地70,1362.0000,下限:1.00上限:2.20,2014年11月05日,https://www.landchina.com/default.aspx?tabid=386&comname=default&wmguid=75c72564-ffd9-426a-954b-8ac2df0903b7&recorderguid=15db2757-62d5-4354-a631-dce666838aaa,2019-08-28 12:35:22
安顺市本级,大西桥镇溪桥小镇地块(二)项目,大西桥镇溪桥小镇,中低价位、中小套型普通商品住房用地,房地产业,0.777590,挂牌出让,70,117.0000,下限:1.00上限:2.30,2014年11月05日,https://www.landchina.com/default.aspx?tabid=386&comname=default&wmguid=75c72564-ffd9-426a-954b-8ac2df0903b7&recorderguid=fba0bf27-90b6-4a5e-8ab1-9f679271a8b9,2019-08-28 12:35:26
安顺市本级,大西桥镇溪桥小镇地块(一)项目,大西桥镇溪桥小镇,中低价位、中小套型普通商品住房用地,房地产业,1.860670,挂牌出让,70,280.0000,下限:1.00上限:1.50,2014年11月05日,https://www.landchina.com/default.aspx?tabid=386&comname=default&wmguid=75c72564-ffd9-426a-954b-8ac2df0903b7&recorderguid=8d6df631-8513-4cbc-a38b-3ba13f7e2166,2019-08-28 12:35:29
安顺市本级,大西桥镇溪桥小镇地块(三)项目,大西桥镇溪桥小镇,批发零售用地,房地产业,2.334940,挂牌出让,批发零售用地40年;其他普通商品住房用地70年;中低价位、中小套型普通商品住房用地70,351.0000,下限:1.00上限:2.00,2014年11月05日,https://www.landchina.com/default.aspx?tabid=386&comname=default&wmguid=75c72564-ffd9-426a-954b-8ac2df0903b7&recorderguid=a12721b4-a8f6-4057-ab32-de3ac013c865,2019-08-28 12:35:36
安顺市本级,武当路与金牛路交叉口东北角地块建设项目,西秀区武当路与金牛路交叉口东北角,中低价位、中小套型普通商品住房用地,房地产业,5.305800,挂牌出让,中低价位、中小套型普通商品住房用地70年;其他普通商品住房用地70年;批发零售用地40年;,10559.0000,下限:1.00上限:2.20,2014年11月05日,https://www.landchina.com/default.aspx?tabid=386&comname=default&wmguid=75c72564-ffd9-426a-954b-8ac2df0903b7&recorderguid=2518b154-530a-4d28-8ca8-ad1f8f2785d5,2019-08-28 12:35:43
安顺市本级,武当路与北航路交叉口西南角地块建设项目,西秀区武当路与北航路交叉口西南角,中低价位、中小套型普通商品住房用地,房地产业,4.707100,挂牌出让,中低价位、中小套型普通商品住房用地70年;其他普通商品住房用地70年;商务金融用地40年;,707.0000,下限:1.00上限:2.50,2014年11月05日,https://www.landchina.com/default.aspx?tabid=386&comname=default&wmguid=75c72564-ffd9-426a-954b-8ac2df0903b7&recorderguid=35ca2a00-01d9-42c2-9514-c1a2fe7da553,2019-08-28 12:35:51
安顺市本级,金牛山东北角建设项目,西秀区金牛山东北角,中低价位、中小套型普通商品住房用地,商务服务业,4.025700,挂牌出让,其他普通商品住房用地70年;批发零售用地40年;中低价位、中小套型普通商品住房用地70年;,604.0000,下限:1.00上限:2.50,2014年11月05日,https://www.landchina.com/default.aspx?tabid=386&comname=default&wmguid=75c72564-ffd9-426a-954b-8ac2df0903b7&recorderguid=53768634-3840-4e7e-9c0e-acf4543ef40a,2019-08-28 12:35:57
安顺市本级,安普8-3地块建设项目,西秀区华西办事处黑石头村,中低价位、中小套型普通商品住房用地,房地产业,4.068800,挂牌出让,批发零售用地40年;其他普通商品住房用地70年;中低价位、中小套型普通商品住房用地70年;,5546.0000,下限:1.00上限:3.50,2014年11月05日,https://www.landchina.com/default.aspx?tabid=386&comname=default&wmguid=75c72564-ffd9-426a-954b-8ac2df0903b7&recorderguid=690a42ad-fb45-4966-917f-7a1b133fea3d,2019-08-28 12:35:59
安顺市本级,北二十号路与北二十五号路交叉口东南角地块建设项目,西秀区北二十号路与北二十五号路交叉口,中低价位、中小套型普通商品住房用地,商务服务业,1.499400,挂牌出让,批发零售用地40年;中低价位、中小套型普通商品住房用地70年;其他普通商品住房用地70年;,225.0000,下限:1.00上限:2.50,2014年11月05日,https://www.landchina.com/default.aspx?tabid=386&comname=default&wmguid=75c72564-ffd9-426a-954b-8ac2df0903b7&recorderguid=ae02ee41-2cad-492e-ac60-8515c23a7cad,2019-08-28 12:36:04
安顺市本级,建设南路与凤东路交叉口安置房地块建设项目,西秀区建设南路与凤东路交叉口,中低价位、中小套型普通商品住房用地,房地产业,1.524300,挂牌出让,其他商服用地40年;中低价位、中小套型普通商品住房用地70年;其他普通商品住房用地70年;,239.0000,下限:1.00上限:5.40,2014年11月05日,https://www.landchina.com/default.aspx?tabid=386&comname=default&wmguid=75c72564-ffd9-426a-954b-8ac2df0903b7&recorderguid=dbd08181-d427-488a-bd1f-bff588180d99,2019-08-28 12:36:08
安顺市本级,虹山湖路东侧(希尔顿酒店对面)地块建设项目,虹山湖路东侧(希尔顿酒店对面),批发零售用地,商务服务业,1.937700,挂牌出让,40,9549.0000,下限:0.00上限:0.80,2014年11月05日,https://www.landchina.com/default.aspx?tabid=386&comname=default&wmguid=75c72564-ffd9-426a-954b-8ac2df0903b7&recorderguid=e35ca81f-9e50-41f7-bdd5-12000c8fe278,2019-08-28 12:36:12
安顺市本级,西秀区武当路与二环路交叉口建设项目,西秀区武当路与二环路交叉口东南角,商务金融用地,商务服务业,10.534611,挂牌出让,40,3403.0000,下限:2.80上限:2.80,2014年05月26日,https://www.landchina.com/default.aspx?tabid=386&comname=default&wmguid=75c72564-ffd9-426a-954b-8ac2df0903b7&recorderguid=b2ba1102-22c5-4800-8a7f-59fd078db067,2019-08-28 12:36:18
安顺市本级,西秀区二环路南侧马家冲地块建设项目,西秀区二环路南侧马家冲,商务金融用地,商务服务业,10.593100,挂牌出让,40,4111.0000,下限:2.80上限:2.80,2014年05月26日,https://www.landchina.com/default.aspx?tabid=386&comname=default&wmguid=75c72564-ffd9-426a-954b-8ac2df0903b7&recorderguid=7a8842a3-82a8-4ab2-bf33-621913854bc6,2019-08-28 12:36:31
安顺市本级,旧州镇南门新区棚户区改造项目,西秀区旧州镇南门田坝客车站到新南街之间,中低价位、中小套型普通商品住房用地,房地产业,1.157557,挂牌出让,其他普通商品住房用地70年;中低价位、中小套型普通商品住房用地70年;批发零售用地40,269.0000,下限:1.00上限:2.00,2014年03月25日,https://www.landchina.com/default.aspx?tabid=386&comname=default&wmguid=75c72564-ffd9-426a-954b-8ac2df0903b7&recorderguid=7dff2968-fd5e-4b1d-bebf-fae419e094fa,2019-08-28 12:36:40
安顺市本级,西秀区四号路与建设路交叉口（大山脚）地块建设项目,西秀区四号路与建设路交叉口（大山脚）,中低价位、中小套型普通商品住房用地,房地产业,1.830900,挂牌出让,其他普通商品住房用地70年;中低价位、中小套型普通商品住房用地70年;批发零售用地40,275.0000,下限:1.00上限:4.50,2014年03月25日,https://www.landchina.com/default.aspx?tabid=386&comname=default&wmguid=75c72564-ffd9-426a-954b-8ac2df0903b7&recorderguid=e85c2d05-fd04-4898-be5f-b5bf22be1101,2019-08-28 12:36:45
安顺市本级,西秀区凤东路与三号路交叉口东北侧地块项目,西秀区凤东路与三号路交叉口东北侧,中低价位、中小套型普通商品住房用地,房地产业,1.169600,挂牌出让,其他普通商品住房用地70年;批发零售用地40年;中低价位、中小套型普通商品住房用地70,176.0000,下限:1.00上限:5.42,2014年03月25日,https://www.landchina.com/default.aspx?tabid=386&comname=default&wmguid=75c72564-ffd9-426a-954b-8ac2df0903b7&recorderguid=8814e3b7-3457-4d0f-abab-d852908cbf99,2019-08-28 12:36:50
安顺市本级,黄果树大街与铁路平交东侧地块建设项目,西秀区黄果树大街与铁路平交东侧地块,批发零售用地,房地产业,3.126400,挂牌出让,40,5264.0000,下限:0.00上限:2.70,2014年03月25日,https://www.landchina.com/default.aspx?tabid=386&comname=default&wmguid=75c72564-ffd9-426a-954b-8ac2df0903b7&recorderguid=1d41dedb-37bc-4bc5-a0ba-13b6efb32e30,2019-08-28 12:36:58
安顺市本级,西秀区原西秀区水利局、农机局和轿子山监狱停车场地块项目,安顺市盔甲路中段,中低价位、中小套型普通商品住房用地,房地产业,1.381450,挂牌出让,批发零售用地40年;中低价位、中小套型普通商品住房用地70年;其他普通商品住房用地70,1178.0000,下限:1.00上限:5.00,2014年03月17日,https://www.landchina.com/default.aspx?tabid=386&comname=default&wmguid=75c72564-ffd9-426a-954b-8ac2df0903b7&recorderguid=fe13ae69-cc91-4e17-8761-971ca8d5eba1,2019-08-28 12:37:08
安顺市本级,西秀区大西桥镇三个村至蔡官镇长冲村地块二（一期）建设项目,西秀区七眼桥镇，东抵西秀区七眼桥镇兴隆村,工业用地,化学原料及化学制品制造业,28.509400,挂牌出让,50,4961.0000,下限:0.10上限:0.10,2014年03月17日,https://www.landchina.com/default.aspx?tabid=386&comname=default&wmguid=75c72564-ffd9-426a-954b-8ac2df0903b7&recorderguid=382ca5d4-f660-481d-abe0-64010974b1bd,2019-08-28 12:37:11
安顺市本级,安普安置地块二建设项目,安顺市西秀区华西办事处黑石头村,中低价位、中小套型普通商品住房用地,房地产业,6.948610,挂牌出让,其他普通商品住房用地70年;中低价位、中小套型普通商品住房用地70年;其他商服用地40年;,1043.0000,下限:1.00上限:3.50,2014年03月12日,https://www.landchina.com/default.aspx?tabid=386&comname=default&wmguid=75c72564-ffd9-426a-954b-8ac2df0903b7&recorderguid=45d4de1c-36d9-4045-93db-7a14fc1a8935,2019-08-28 12:37:16
安顺市本级,安普安置地块一建设项目,安顺市西秀区华西办事处黑石头村,中低价位、中小套型普通商品住房用地,房地产业,2.437700,挂牌出让,中低价位、中小套型普通商品住房用地70年;其他普通商品住房用地70年;其他商服用地40年;,366.0000,下限:1.00上限:2.00,2014年03月12日,https://www.landchina.com/default.aspx?tabid=386&comname=default&wmguid=75c72564-ffd9-426a-954b-8ac2df0903b7&recorderguid=d7b063a9-24df-4edc-bd65-3bccf647463e,2019-08-28 12:37:19
安顺市本级,北山路环形皮鞋厂棚户区改造项目,西秀区虹山湖路北侧,批发零售用地,房地产业,1.332200,挂牌出让,商务金融用地40年;批发零售用地40年;住宿餐饮用地40年;中低价位、中小套型普通商品住房用地70年;,200.0000,下限:1.00上限:5.50,2014年03月12日,https://www.landchina.com/default.aspx?tabid=386&comname=default&wmguid=75c72564-ffd9-426a-954b-8ac2df0903b7&recorderguid=f462b4ff-5acf-42c5-b194-32faa22a49ee,2019-08-28 12:37:44
安顺市本级,安顺市灯泡厂地块建设项目,安顺市灯泡厂地块,中低价位、中小套型普通商品住房用地,房地产业,0.150810,挂牌出让,批发零售用地40年;中低价位、中小套型普通商品住房用地70年;其他普通商品住房用地70,551.0000,下限:1.00上限:4.50,2014年03月10日,https://www.landchina.com/default.aspx?tabid=386&comname=default&wmguid=75c72564-ffd9-426a-954b-8ac2df0903b7&recorderguid=72a10dde-f4e4-4340-b7f6-366451bb44d7,2019-08-28 12:38:00
安顺市本级,头铺村、麒麟村城中村改造项目（地块三）,安顺市西秀区东关办事处头铺村、麒麟村,中低价位、中小套型普通商品住房用地,房地产业,5.432200,挂牌出让,批发零售用地40年;住宿餐饮用地40年;商务金融用地40年;中低价位、中小套型普通商品住房用地70年;其他普通商品住房用地70年;,65.0000,下限:1.00上限:4.50,2014年03月04日,https://www.landchina.com/default.aspx?tabid=386&comname=default&wmguid=75c72564-ffd9-426a-954b-8ac2df0903b7&recorderguid=be86b9b1-ac7b-41ba-8391-11f12aa69507,2019-08-28 12:38:14
安顺市本级,头铺村、麒麟村城中村改造项目（地块二）,安顺市西秀区东关办事处头铺村、麒麟村,中低价位、中小套型普通商品住房用地,房地产业,4.932250,挂牌出让,批发零售用地40年;住宿餐饮用地40年;商务金融用地40年;中低价位、中小套型普通商品住房用地70年;其他普通商品住房用地70年;,85.0000,下限:1.00上限:4.50,2014年03月04日,https://www.landchina.com/default.aspx?tabid=386&comname=default&wmguid=75c72564-ffd9-426a-954b-8ac2df0903b7&recorderguid=c51f184a-00c1-4f63-b3a7-9f61d8250ef3,2019-08-28 12:38:28
安顺市本级,头铺村、麒麟村城中村改造项目（地块一）,安顺市西秀区东关办事处头铺村、麒麟村,中低价位、中小套型普通商品住房用地,房地产业,2.902500,挂牌出让,商务金融用地40年;批发零售用地40年;住宿餐饮用地40年;中低价位、中小套型普通商品住房用地70年;其他普通商品住房用地70年;,50.0000,下限:1.00上限:4.50,2014年03月04日,https://www.landchina.com/default.aspx?tabid=386&comname=default&wmguid=75c72564-ffd9-426a-954b-8ac2df0903b7&recorderguid=fa3fb08e-3841-42ab-8585-1cf0cbf25a2c,2019-08-28 12:38:34
安顺市本级,西秀区东二环路与黄果树大街交叉口东北角（H1-06）地块建设项目,西秀区东二环路与黄果树大街交叉口东北角,中低价位、中小套型普通商品住房用地,房地产业,1.663300,挂牌出让,批发零售用地40年;中低价位、中小套型普通商品住房用地70年;其他普通商品住房用地70年;,1713.0000,下限:1.00上限:3.50,2014年01月16日,https://www.landchina.com/default.aspx?tabid=386&comname=default&wmguid=75c72564-ffd9-426a-954b-8ac2df0903b7&recorderguid=969c8329-8296-4113-a13c-613cc1681b68,2019-08-28 12:38:38
安顺市本级,西秀区老大十字区委北侧地块建设项目,西秀区老大十字区委北侧地块,中低价位、中小套型普通商品住房用地,房地产业,2.156150,挂牌出让,中低价位、中小套型普通商品住房用地70年;商务金融用地40年;批发零售用地40,300.0000,下限:4.50上限:4.50,2014年01月06日,https://www.landchina.com/default.aspx?tabid=386&comname=default&wmguid=75c72564-ffd9-426a-954b-8ac2df0903b7&recorderguid=9f791b50-5695-455b-8b87-1e2f9e265258,2019-08-28 12:38:44
安顺市本级,安顺市国有资产管理有限公司建设原市委党校片区地块项目,安顺市西秀区市东路42号,中低价位、中小套型普通商品住房用地,其他金融服务,3.774701,挂牌出让,中低价位、中小套型普通商品住房用地70年;其他普通商品住房用地70年;住宿餐饮用地40年;其他商服用地40年;,13468.0000,下限:1.00上限:2.60,2013年12月10日,https://www.landchina.com/default.aspx?tabid=386&comname=default&wmguid=75c72564-ffd9-426a-954b-8ac2df0903b7&recorderguid=725628ea-9adb-4081-95e6-07e9bcb4bb9a,2019-08-28 12:38:51
安顺市本级,安顺市西秀区教育局西水路11号地块建设项目,安顺市西秀区西水路11号,其他商服用地,房地产业,0.200686,挂牌出让,40,157.0000,下限:1.00上限:1.00,2013年11月21日,https://www.landchina.com/default.aspx?tabid=386&comname=default&wmguid=75c72564-ffd9-426a-954b-8ac2df0903b7&recorderguid=4bfcfa03-0ffb-481b-8bb9-8a044d4eabb2,2019-08-28 12:38:58
安顺市本级,西秀区黄果树大街市人民医院东侧地块建设项目,安顺市西秀区黄果树大街市人民医院东侧,中低价位、中小套型普通商品住房用地,房地产业,0.072800,挂牌出让,其他商服用地40年;中低价位、中小套型普通商品住房用地70年;其他普通商品住房用地70,96.0000,下限:1.00上限:3.80,2013年11月20日,https://www.landchina.com/default.aspx?tabid=386&comname=default&wmguid=75c72564-ffd9-426a-954b-8ac2df0903b7&recorderguid=384f426c-998b-4ba0-9f06-7ffc4efdf96d,2019-08-28 12:39:09
安顺市本级,安顺市西秀区黄果树大街与龙青路交叉口南侧地块建设项目,安顺市西秀区黄果树大街与龙青路交叉口南侧,科教用地,教育业,0.930510,挂牌出让,50,712.0000,下限:0.80上限:0.80,2013年11月20日,https://www.landchina.com/default.aspx?tabid=386&comname=default&wmguid=75c72564-ffd9-426a-954b-8ac2df0903b7&recorderguid=a487acd0-ca40-4d6a-9f8e-7244aa694def,2019-08-28 12:39:17
安顺市本级,南水路原区政协地块项目,安顺西秀区南水路原政协,中低价位、中小套型普通商品住房用地,房地产业,0.524600,挂牌出让,中低价位、中小套型普通商品住房用地70年;其他普通商品住房用地70年;其他商服用地40,112.0000,下限:1.00上限:6.00,2013年11月08日,https://www.landchina.com/default.aspx?tabid=386&comname=default&wmguid=75c72564-ffd9-426a-954b-8ac2df0903b7&recorderguid=2bb4d09b-c101-4937-9ddc-372d87fd285a,2019-08-28 12:39:23
安顺市本级,北四号路西侧（东关一期廉租房对面）建设项目,安顺西秀区北四号路西侧（东关一期廉租房对面）,医卫慈善用地,卫生,0.775197,挂牌出让,50,576.0000,下限:0.00上限:1.80,2013年11月08日,https://www.landchina.com/default.aspx?tabid=386&comname=default&wmguid=75c72564-ffd9-426a-954b-8ac2df0903b7&recorderguid=4658e1b6-f3b6-49a2-bc28-6e04d94ebb40,2019-08-28 12:39:38
